{
  "version": "phase2-zone-contract-v1",
  "candidate_id": "lima_este_santa_eulalia_rimac",
  "contract_status": "DRAFT",
  "deployment_status": "RESEARCH_ONLY",
  "production_use": false,
  "alerting_enabled": false,
  "decision_thresholds": null,
  "hydraulic_factors": null,
  "missing_data_rule": "UNKNOWN_NOT_LOW_RISK",
  "identity": {
    "system_name": "Sistema Santa Eulalia–Rímac alto y quebradas asociadas",
    "department": "Lima",
    "province_or_corridor": "Huarochirí / Santa Eulalia–Ricardo Palma–Chaclacayo–Lurigancho-Chosica",
    "territorial_profile": "metropolitan_huarochiri_interface_and_river_corridor",
    "inside_lima_metropolitana": true
  },
  "hazard_model": {
    "mechanism_status": "TO_BE_RESOLVED",
    "mechanism_preliminary": "compound_local_debris_flows_santa_eulalia_inflow_and_rimac_river_flood",
    "selected_model_family": null
  },
  "official_source_ids": [
    "INGEMMET-SIGRID-3642",
    "ANA-CASHAHUACRA-VULNERABLE-5769",
    "CENEPRED-RPAS-CASHAHUACRA-SHINGOLAY-5291",
    "CENEPRED-RPAS-CASHAHUACRA-6765",
    "ANA-FM-SANTA-EULALIA-6063",
    "ANA-FM-RIMAC-9803",
    "ANA-FM-RIMAC-13214"
  ],
  "assets": {
    "geometry": {
      "status": "PARTIAL",
      "path": "site/data/phase2/geometries/w1_santa_eulalia_rimac.geojson",
      "source_ids": [
        "ANA-CASHAHUACRA-VULNERABLE-5769",
        "CENEPRED-RPAS-CASHAHUACRA-SHINGOLAY-5291",
        "CENEPRED-RPAS-CASHAHUACRA-6765",
        "ANA-FM-SANTA-EULALIA-6063",
        "ANA-FM-RIMAC-9803",
        "ANA-FM-RIMAC-13214",
        "INGEMMET-CHOSICA-SANTA-EULALIA-2015"
      ]
    },
    "exposure": {
      "status": "PARTIAL",
      "path": "site/data/validation/phase2_research_evidence/ingemmet_chosica_santa_eulalia_2015.json",
      "source_ids": [
        "INGEMMET-SIGRID-3642",
        "INGEMMET-CHOSICA-SANTA-EULALIA-2015",
        "ANA-CASHAHUACRA-VULNERABLE-5769"
      ]
    },
    "historical_events": {
      "status": "READY",
      "path": "site/data/validation/phase2_research_evidence/ingemmet_chosica_santa_eulalia_2015.json",
      "source_ids": [
        "INGEMMET-SIGRID-3642",
        "INGEMMET-CHOSICA-SANTA-EULALIA-2015"
      ],
      "minimum_verified_event_days": 1,
      "minimum_verified_none_days": 10
    },
    "observations": {
      "status": "PARTIAL",
      "path": "site/data/validation/phase2_research_evidence/ingemmet_chosica_santa_eulalia_2015.json",
      "source_ids": [
        "INGEMMET-CHOSICA-SANTA-EULALIA-2015"
      ]
    },
    "forecast": {
      "status": "CANDIDATE",
      "path": null,
      "source_ids": [
        "NASA-GEOS-CF"
      ]
    },
    "hydraulic_context": {
      "status": "CANDIDATE",
      "path": null,
      "source_ids": [
        "ANA-FM-SANTA-EULALIA-6063",
        "ANA-FM-RIMAC-9803",
        "ANA-FM-RIMAC-13214"
      ]
    }
  },
  "validation": {
    "activation_gate": "BLOCKED",
    "required_reviews": [
      "scientific",
      "hydrological_or_hydraulic",
      "compound_hazard",
      "local_outcome"
    ],
    "promotion_requires_all_gates": true,
    "review_evidence": []
  },
  "notes": [
    "Modelar por separado quebradas locales de respuesta rápida, aporte del río Santa Eulalia y nivel/capacidad del Rímac receptor.",
    "INGEMMET 2015 confirma en campo el evento positivo del 23/03/2015 en Cashahuacra y documenta geometría, depósito, impacto y contexto de lluvia antecedente; esto fortalece el componente local de flujo de detritos, no demuestra por sí solo desborde del Rímac.",
    "La misma fuente contiene outcome positivo de Pedregal y otras quebradas Chosica; para el carril clean-room Pedregal permanece sellada y sólo puede usarse después del safe-unblind independiente.",
    "Cashahuacra/Shingolay dispone de evidencia oficial de evento, exposición y geometría candidata; aún no constituye una geometría IRFEN validada.",
    "Evaluar activaciones simultáneas como escenarios compuestos solo después de validar cada componente y su sincronización.",
    "No inferir desborde del Rímac a partir de lluvia o activación de quebradas por sí solas: se requieren nivel/caudal y contexto hidráulico observados.",
    "Mantener este contrato de expansión separado del piloto v0.8 Chosica/Huaycoloro; no cambia su alcance ni sus umbrales."
  ]
}
